{
  "id": "best-planner-apps-kw",
  "createdAt": "2026-03-19T00:00:00.000Z",
  "term": "best planner apps",
  "articleId": "best-planner-apps",
  "searchVolume": 3600,
  "keywordDifficulty": 22,
  "cpc": 2.50,
  "intent": "commercial",
  "targetSection": "Title & intro",
  "occurrences": 5,
  "impressions": 30,
  "clicks": 0,
  "ctr": 0,
  "position": 21.5,
  "quadrant": "long-term-target",
  "status": "tracking"
}
