{
  "id": "time-blocking-kw",
  "createdAt": "2026-03-19T00:00:00.000Z",
  "term": "time blocking software",
  "articleId": "best-planner-apps",
  "searchVolume": 14800,
  "keywordDifficulty": 13,
  "cpc": 4.20,
  "intent": "commercial",
  "targetSection": "Time blocking section",
  "occurrences": 3,
  "impressions": 99,
  "clicks": 0,
  "ctr": 0,
  "position": 52.98,
  "quadrant": "dog",
  "status": "tracking"
}
