{
  "id": "adhd-planner-kw",
  "createdAt": "2026-03-19T00:00:00.000Z",
  "term": "planner apps for adhd",
  "articleId": "planner-apps-adhd",
  "searchVolume": 8100,
  "keywordDifficulty": 0,
  "cpc": 1.80,
  "intent": "commercial",
  "targetSection": "Title & H1",
  "occurrences": 4,
  "impressions": 45,
  "clicks": 0,
  "ctr": 0,
  "position": 17.73,
  "quadrant": "ctr-opportunity",
  "status": "tracking"
}
